<?xml version="1.0" encoding="UTF-8"?>
<dozent id="3" xmlns="http://www.example.org/dozent" xmlns:xsi="http://www.w3.org/2001/XMLSchema-instance"
    xsi:schemaLocation="http://example.org/dozent ../../xsd/dozent.xsd ">
		<titel>Prof. Dr. Horst Stenzel</titel>
		<adresse titel="Adresse">
			<anschrift>Steinmüllerallee 1, 51643 Gummersbach</anschrift>
			<raum titel="Raum" nummer="3207" />
			<tel>
				<nummer art="Telefon" nr="+49 2261 8196 6403" />
				<nummer art="Fax" nr="+49 2261 8196 6666" />
			</tel>
			<email adresse="stenzel at gm.fh-koeln.de" />
		</adresse>
		<lehre>
			<lehrgebiet>Angewandte Mathematik und Informatik</lehrgebiet>
			<schwerpunkte>Algortihmen für Computer-Graphik und Betriebssysteme</schwerpunkte>
			<url>http://www.gm.fh-koeln.de/hstl</url>
			<sprechzeit>dienstags 14:00 - 14:45 Uhr</sprechzeit>
			<veranstaltungen>
				<list kuerzel="BS1">Betriebssysteme und verteilte Systeme</list>
			</veranstaltungen>
		</lehre>
		<newsticker titel="Newsticker">
			<eintrag datum="2013-05-10" verfasser="Prof. Dr. Horst Stenzel" modul="BS1" text="Am Freitag den 17.05.2013 findet die Vorlesung diesmal außerplanmäßig in Raum 0401 statt." />
			<eintrag datum="2013-04-01" verfasser="Prof. Dr. Horst Stenzel" modul="BS1" text="Die Staffelpläne sine online! Ab nächster Woche beginnt das Praktikum" />
			<eintrag datum="2013-03-22" verfasser="Prof. Dr. Horst Stenzel" modul="BS1" text="Organisation und Gruppeneinteilung für die Praktika!" />
		</newsticker>
		<abonnenten>
			<abonnent name="Daniela Kucharczyk" />
		</abonnenten>
</dozent>
